[
  {
    "name": "uv",
    "platforms": ["linux/amd64", "linux/arm64"],
    "source_digests": {
      "linux/amd64": "ghcr.io/astral-sh/uv:0.10.7@sha256:0ca776d5bd774b0f8a9092100166ac46bf93386da17b8bf626f8e60b1f2d1c77",
      "linux/arm64": "ghcr.io/astral-sh/uv:0.10.7@sha256:5fe7b2b0499a485ee86e1e0d2154e1556a08dffeb5f72b204895af5212a2069c"
    },
    "cache_env": {"UV_CACHE_DIR": "/home/runner/.cache/uv"},
    "registry_hosts": ["pypi.org", "files.pythonhosted.org"],
    "probe": ["uv", "--version"]
  },
  {
    "name": "rust",
    "platforms": ["linux/amd64", "linux/arm64"],
    "source_digests": {
      "linux/amd64": "docker.io/library/rust:1.95.0-bookworm@sha256:4c2fd73ef19c5ef9d54bee03b06b2839a392604fbfcd578ed948b71b37c1d7fb",
      "linux/arm64": "docker.io/library/rust:1.95.0-bookworm@sha256:8e45ae5b178fa788bbbd818b42a1f93a6e2c03e7144badd5e0a37087537177e1"
    },
    "cache_env": {"CARGO_HOME": "/home/runner/.cargo"},
    "registry_hosts": ["index.crates.io", "static.crates.io"],
    "probe": ["cargo", "--version"]
  },
  {
    "name": "pnpm",
    "platforms": ["linux/amd64", "linux/arm64"],
    "source_digests": {
      "linux/amd64": "registry.npmjs.org/pnpm/-/pnpm-9.15.9.tgz@sha256:cf86a7ad764406395d4286a6d09d730711720acc6d93e9dce9ac7ac4dc4a28a7",
      "linux/arm64": "registry.npmjs.org/pnpm/-/pnpm-9.15.9.tgz@sha256:cf86a7ad764406395d4286a6d09d730711720acc6d93e9dce9ac7ac4dc4a28a7"
    },
    "cache_env": {"PNPM_HOME": "/home/runner/.local/share/pnpm"},
    "registry_hosts": ["registry.npmjs.org"],
    "probe": ["pnpm", "--version"]
  },
  {
    "name": "build-essential",
    "platforms": ["linux/amd64", "linux/arm64"],
    "source_digests": {
      "linux/amd64": "docker.io/library/debian:bookworm-slim@sha256:a4672c0cb26fbdde88e38fa2dfb6c681942306680e41e4378b28770b6e79ee91",
      "linux/arm64": "docker.io/library/debian:bookworm-slim@sha256:a1b86db52ce3daef089e45aabe36dfec4091f82464c25c1fdcf03de197cbe82a"
    },
    "cache_env": {},
    "registry_hosts": [],
    "probe": ["gcc", "--version"]
  },
  {
    "name": "docker-cli",
    "platforms": ["linux/amd64", "linux/arm64"],
    "source_digests": {
      "linux/amd64": "docker.io/library/docker:29.9.0-cli@sha256:4caa52207e95c68c3087006eefb3a5f6ca48ad1c0ba3aa3e6843549a0720b7bb",
      "linux/arm64": "docker.io/library/docker:29.9.0-cli@sha256:b840c948ec2a78bf90a99e713f7ad711c0dea887a86723fba3d47703dfe43506"
    },
    "cache_env": {"DOCKER_CONFIG": "/home/runner/.docker"},
    "registry_hosts": [],
    "probe": ["docker", "--version"]
  }
]
